{
  "format_version": "0.3.0",
  "canonicalization": "TRACE-C14N-1",
  "manifest": {
    "run_id": "isolated-lifecycle-demo",
    "execution_mode": "SYNTHETIC",
    "security_scope": "isolated-test",
    "profile": "FINALIZED_ANALYSIS",
    "graph_version": 1,
    "schema_hash": "431dec2f341a0047ac71c2cbd8996f91e39fb9173bf0b15278191aae1099b953",
    "record_hashes": {
      "claim:9eb26706642d34ff64224223f1a70355c7223cfca466b668bf42338432af1d98": "9eb26706642d34ff64224223f1a70355c7223cfca466b668bf42338432af1d98",
      "schema:431dec2f341a0047ac71c2cbd8996f91e39fb9173bf0b15278191aae1099b953": "431dec2f341a0047ac71c2cbd8996f91e39fb9173bf0b15278191aae1099b953",
      "policy:aafd8cb87ff965cc290a45d994f46dbb8b30fe0da81b05b782ed48e943e02ce4": "aafd8cb87ff965cc290a45d994f46dbb8b30fe0da81b05b782ed48e943e02ce4",
      "source:3c10a069fa8a84d26b8d21b0a8d10610f500aa1fec23a9a3ad295fbc304d1a34": "3c10a069fa8a84d26b8d21b0a8d10610f500aa1fec23a9a3ad295fbc304d1a34",
      "source:fd28aa81850f425be68180cfdae2cea106993edbd94caba91201c2e5671e62e3": "fd28aa81850f425be68180cfdae2cea106993edbd94caba91201c2e5671e62e3",
      "receipt:7a4829a883e0f249ce2df39f30da1948f3c7a773e343f021ba53fe9b40d65c06": "7a4829a883e0f249ce2df39f30da1948f3c7a773e343f021ba53fe9b40d65c06",
      "transaction:83c7b9153401029d78701dc5c421363c1d0499276dd85dc1c38fe0edefd7e78a": "83c7b9153401029d78701dc5c421363c1d0499276dd85dc1c38fe0edefd7e78a",
      "graph-snapshot:032640e1ee680332a1e2ae7d10d8bd729eaa73225836738dec8e213d13517eb8": "032640e1ee680332a1e2ae7d10d8bd729eaa73225836738dec8e213d13517eb8",
      "evidence:6b155fec1c6d6a2c72d6cabffd1fbf045f4079f58d3db00729e1c6ba1c1083b3": "6b155fec1c6d6a2c72d6cabffd1fbf045f4079f58d3db00729e1c6ba1c1083b3",
      "evidence:d63c6109f15b2c4d264466e69dae3111cb99c8417878606fb338c2700fa13b71": "d63c6109f15b2c4d264466e69dae3111cb99c8417878606fb338c2700fa13b71",
      "candidate-1": "82d046cd8435b01e0bf27c1cf6a96c62a965d7c6b270ddc4b2cc73f5021487cb",
      "candidate-2": "d0918c55b9a36b227d6970f5cb329e375b955bf47f235e996d74669575f188cd",
      "pack-demo": "380b5907c8aa948c5bbb5232653abf424c42b35a7b977f2fbd022f45e8e46767",
      "observation:a9d609873ca217a8f52a82114d7213f155c117711b0feb538a46826e1a9d39f6": "a9d609873ca217a8f52a82114d7213f155c117711b0feb538a46826e1a9d39f6",
      "observation:bef8e222ad1870b4a25689f0fc320de516fb3ed0b1fd15a769fb7a67b1ee5ffb": "bef8e222ad1870b4a25689f0fc320de516fb3ed0b1fd15a769fb7a67b1ee5ffb",
      "resolution-batch:a02a1cac60ddb66579d37fa128894137463e18bb881dd76ad9db4eb709edfd6a": "a02a1cac60ddb66579d37fa128894137463e18bb881dd76ad9db4eb709edfd6a",
      "resolution:7ef05234bd40738023d5524e4b0e82551e1fb8c68c8f39e0a5d8ff518a6739ef": "7ef05234bd40738023d5524e4b0e82551e1fb8c68c8f39e0a5d8ff518a6739ef",
      "resolution:3b0734e4c8ac591ad161233699b3c6e89e3b9a4b6985ecaa3a5d785aef5b07fc": "3b0734e4c8ac591ad161233699b3c6e89e3b9a4b6985ecaa3a5d785aef5b07fc",
      "evaluation:ff55c009d3bc2d456683609a2edb57635ddfe442ee104e1b2d6ce87a27eb2959": "ff55c009d3bc2d456683609a2edb57635ddfe442ee104e1b2d6ce87a27eb2959",
      "evaluation:3e95512220c9c48d655bb040d7d5ef4547a777d83eb33f33148559e211bc1e0f": "3e95512220c9c48d655bb040d7d5ef4547a777d83eb33f33148559e211bc1e0f",
      "plan:fd15c0a4cb1b7ffc33a28427aa8b0975208fdbcdfd9a1f4c4523ae160c83ee8d": "fd15c0a4cb1b7ffc33a28427aa8b0975208fdbcdfd9a1f4c4523ae160c83ee8d",
      "receipt:9f449aeba2c341a6e751a3a47e771d2bf70be4ff3a3f42e1846049f366132552": "9f449aeba2c341a6e751a3a47e771d2bf70be4ff3a3f42e1846049f366132552",
      "receipt:8665b64bd9b9f78e95c95917793ffca5a0edb1f6b08d04d621f2c1d7c3498569": "8665b64bd9b9f78e95c95917793ffca5a0edb1f6b08d04d621f2c1d7c3498569"
    },
    "source_status": {
      "source:3c10a069fa8a84d26b8d21b0a8d10610f500aa1fec23a9a3ad295fbc304d1a34": {
        "active": true,
        "epoch": 0,
        "permission": "READ",
        "tombstone": false,
        "updated_at": "2026-09-30T07:01:47.598292Z"
      },
      "source:fd28aa81850f425be68180cfdae2cea106993edbd94caba91201c2e5671e62e3": {
        "active": true,
        "epoch": 0,
        "permission": "READ",
        "tombstone": false,
        "updated_at": "2026-09-30T07:01:47.598292Z"
      }
    },
    "record_events": {
      "claim:9eb26706642d34ff64224223f1a70355c7223cfca466b668bf42338432af1d98": "isolated-lifecycle-demo:event:1",
      "schema:431dec2f341a0047ac71c2cbd8996f91e39fb9173bf0b15278191aae1099b953": "isolated-lifecycle-demo:event:2",
      "policy:aafd8cb87ff965cc290a45d994f46dbb8b30fe0da81b05b782ed48e943e02ce4": "isolated-lifecycle-demo:event:3",
      "source:3c10a069fa8a84d26b8d21b0a8d10610f500aa1fec23a9a3ad295fbc304d1a34": "isolated-lifecycle-demo:event:4",
      "source:fd28aa81850f425be68180cfdae2cea106993edbd94caba91201c2e5671e62e3": "isolated-lifecycle-demo:event:5",
      "evidence:6b155fec1c6d6a2c72d6cabffd1fbf045f4079f58d3db00729e1c6ba1c1083b3": "isolated-lifecycle-demo:event:6",
      "receipt:7a4829a883e0f249ce2df39f30da1948f3c7a773e343f021ba53fe9b40d65c06": "isolated-lifecycle-demo:event:7",
      "graph-snapshot:032640e1ee680332a1e2ae7d10d8bd729eaa73225836738dec8e213d13517eb8": "isolated-lifecycle-demo:event:8",
      "evidence:d63c6109f15b2c4d264466e69dae3111cb99c8417878606fb338c2700fa13b71": "isolated-lifecycle-demo:event:9",
      "candidate-1": "isolated-lifecycle-demo:event:10",
      "transaction:83c7b9153401029d78701dc5c421363c1d0499276dd85dc1c38fe0edefd7e78a": "isolated-lifecycle-demo:event:11",
      "candidate-2": "isolated-lifecycle-demo:event:12",
      "pack-demo": "isolated-lifecycle-demo:event:13",
      "observation:a9d609873ca217a8f52a82114d7213f155c117711b0feb538a46826e1a9d39f6": "isolated-lifecycle-demo:event:14",
      "observation:bef8e222ad1870b4a25689f0fc320de516fb3ed0b1fd15a769fb7a67b1ee5ffb": "isolated-lifecycle-demo:event:15",
      "resolution-batch:a02a1cac60ddb66579d37fa128894137463e18bb881dd76ad9db4eb709edfd6a": "isolated-lifecycle-demo:event:16",
      "resolution:7ef05234bd40738023d5524e4b0e82551e1fb8c68c8f39e0a5d8ff518a6739ef": "isolated-lifecycle-demo:event:17",
      "resolution:3b0734e4c8ac591ad161233699b3c6e89e3b9a4b6985ecaa3a5d785aef5b07fc": "isolated-lifecycle-demo:event:18",
      "evaluation:ff55c009d3bc2d456683609a2edb57635ddfe442ee104e1b2d6ce87a27eb2959": "isolated-lifecycle-demo:event:19",
      "evaluation:3e95512220c9c48d655bb040d7d5ef4547a777d83eb33f33148559e211bc1e0f": "isolated-lifecycle-demo:event:20",
      "plan:fd15c0a4cb1b7ffc33a28427aa8b0975208fdbcdfd9a1f4c4523ae160c83ee8d": "isolated-lifecycle-demo:event:21",
      "receipt:9f449aeba2c341a6e751a3a47e771d2bf70be4ff3a3f42e1846049f366132552": "isolated-lifecycle-demo:event:22",
      "receipt:8665b64bd9b9f78e95c95917793ffca5a0edb1f6b08d04d621f2c1d7c3498569": "isolated-lifecycle-demo:event:23"
    },
    "policy_version": "reviewed-sandbox-v1",
    "policy_id": "policy:aafd8cb87ff965cc290a45d994f46dbb8b30fe0da81b05b782ed48e943e02ce4",
    "source_status_as_of": "2026-09-30T07:01:47.680539Z",
    "ledger_head": "6c787b815f38257d7b291ca3936d9b747e4b6b4648b2d236d9265a843e4cc4f1",
    "checkpoint_id": "3fd1424a163059b6fe7cc5443ce0c1709ad2b45b04d77ad827ac8bce689297d5",
    "transaction_id": null
  },
  "records": [
    {
      "id": "claim:9eb26706642d34ff64224223f1a70355c7223cfca466b668bf42338432af1d98",
      "kind": "claim",
      "hash": "9eb26706642d34ff64224223f1a70355c7223cfca466b668bf42338432af1d98",
      "body": {
        "text": "Aster joined Meridian in 2024.",
        "language": "en",
        "revision": 1
      }
    },
    {
      "id": "schema:431dec2f341a0047ac71c2cbd8996f91e39fb9173bf0b15278191aae1099b953",
      "hash": "431dec2f341a0047ac71c2cbd8996f91e39fb9173bf0b15278191aae1099b953",
      "kind": "schema",
      "body": {
        "relations": {
          "different_from": {
            "allow_self": false,
            "domain": "*",
            "incompatible": [],
            "inverse_of": null,
            "range": "*",
            "symmetric": true,
            "transitive": false
          },
          "refutes": {
            "allow_self": false,
            "domain": "Document",
            "incompatible": [
              "supports"
            ],
            "inverse_of": null,
            "range": "Claim",
            "symmetric": false,
            "transitive": false
          },
          "same_as": {
            "allow_self": false,
            "domain": "*",
            "incompatible": [],
            "inverse_of": null,
            "range": "*",
            "symmetric": true,
            "transitive": true
          },
          "supports": {
            "allow_self": false,
            "domain": "Document",
            "incompatible": [
              "refutes"
            ],
            "inverse_of": null,
            "range": "Claim",
            "symmetric": false,
            "transitive": false
          }
        },
        "version": "demo-schema-v1"
      }
    },
    {
      "id": "policy:aafd8cb87ff965cc290a45d994f46dbb8b30fe0da81b05b782ed48e943e02ce4",
      "kind": "policy",
      "hash": "aafd8cb87ff965cc290a45d994f46dbb8b30fe0da81b05b782ed48e943e02ce4",
      "body": {
        "version": "reviewed-sandbox-v1",
        "mode": "REVIEWED",
        "security_scope": "isolated-test",
        "population": "fabricated-fixtures-not-qualified",
        "allowed_modes": [
          "SYNTHETIC"
        ],
        "maximum_risk": "R5",
        "qualification_metric": "ERRORS_PER_ACCEPTED_ACTION",
        "required_checks": [
          "CAUSAL_DEPENDENCIES",
          "COMPLETE_CLOSURE",
          "CURRENT_SOURCE_STATUS",
          "EFFECTIVE_RISK",
          "EXACT_MATERIALIZATION",
          "GLOBAL_FEASIBILITY",
          "GRAPH_AND_SCHEMA_VERSION",
          "OBSERVATION_PROVENANCE",
          "POLICY_APPLICABILITY",
          "TYPED_RECORDS"
        ]
      }
    },
    {
      "id": "source:3c10a069fa8a84d26b8d21b0a8d10610f500aa1fec23a9a3ad295fbc304d1a34",
      "kind": "source",